{
  "formatVersion": 1,
  "id": "001",
  "bookId": "ugetsu",
  "title": "The House amid the Reeds · I",
  "titleJa": "浅茅が宿　現代語訳・其の一",
  "sequence": 1,
  "layers": [
    {
      "number": 1,
      "label": "Orientation",
      "description": "The whole passage in English, before Japanese begins to enter."
    },
    {
      "number": 2,
      "label": "The place",
      "description": "Three names establish the old landscape of Mamma."
    },
    {
      "number": 3,
      "label": "The man",
      "description": "Katsushirō appears, and the opening sentence becomes Japanese."
    },
    {
      "number": 4,
      "label": "Inheritance",
      "description": "The continuity of the household enters through three expressions."
    },
    {
      "number": 5,
      "label": "The fields",
      "description": "The family’s material possessions begin to take Japanese form."
    },
    {
      "number": 6,
      "label": "Prosperity",
      "description": "The inherited household reaches its former fullness."
    },
    {
      "number": 7,
      "label": "Temperament",
      "description": "Three words reveal Katsushirō’s careless inward disposition."
    },
    {
      "number": 8,
      "label": "Farming",
      "description": "The occupation and the burden he sees in it enter the page."
    },
    {
      "number": 9,
      "label": "The fall",
      "description": "The complete modern-Japanese passage stands by itself."
    }
  ],
  "layersPath": "layers",
  "notesPath": "notes.json",
  "commentaryPath": "commentary.md"
}
